library/src/amd_detail/rocblaslt/src/Tensile/Logic/asm_full/aldebaran/104CU/GridBased/aldebaran_Cijk_Ailk_Bljk_HHS_BH_B2BG.yaml
- {MinimumRequiredVersion: 4.33.0}
- aldebaran
- gfx90a
- [Device 0050, Device 0051, Device 0052, Device 0054, Device 0062, Device 7400, Device
    SolutionIndex: 0
    SolutionNameMin: Cijk_Ailk_Bljk_HHS_BH_B2BG_MT32x64x32_MI16x16x16x1_SN_1LDSB0_EPS0_GRVWA4_IU1_LBSPPA0_LBSPPB0_LPA4_LPB4_MIWG2_2_MIWT1_2_PGR2_SIA3_SVW4_VWA1
    SolutionIndex: 1
    SolutionNameMin: Cijk_Ailk_Bljk_HHS_BH_B2BG_MT64x64x32_MI16x16x16x1_SN_1LDSB0_EPS0_GRVWA8_IU1_LBSPPA128_LBSPPB0_LPA0_LPB4_MIWG2_2_MIWT2_2_PGR2_SIA3_SVW8_VWA2
    SolutionIndex: 2
    SolutionNameMin: Cijk_Ailk_Bljk_HHS_BH_B2BG_MT32x128x32_MI16x16x16x1_SN_1LDSB0_GRVWA4_IU1_LBSPPA0_LBSPPB0_LPA8_LPB4_MIWG1_4_MIWT2_2_SIA3_SVW8_VWA2
    SolutionIndex: 3
    SolutionNameMin: Cijk_Ailk_Bljk_HHS_BH_B2BG_MT64x128x32_MI16x16x4x4_SN_1LDSB0_GRVWA8_IU1_LBSPPA128_LBSPPB0_LPA8_LPB4_MIWG1_4_MIWT2_1_SIA3_SVW8_VWA2
    SolutionIndex: 4
    SolutionNameMin: Cijk_Ailk_Bljk_HHS_BH_B2BG_MT64x128x32_MI16x16x4x4_SN_1LDSB0_GRVWA8_IU1_LBSPPA0_LBSPPB0_LPA8_LPB4_MIWG1_4_MIWT2_1_SIA3_SVW8_VWA2
    SolutionIndex: 5
    SolutionNameMin: Cijk_Ailk_Bljk_HHS_BH_B2BG_MT32x256x32_MI16x16x16x1_SN_GRVWA4_LPA8_LPB4_MIWG1_4_MIWT2_4_SVW8_VWA2
    SolutionIndex: 6
    SolutionNameMin: Cijk_Ailk_Bljk_HHS_BH_B2BG_MT64x256x32_MI32x32x8x1_SN_GRVWA8_LPA0_LPB0_MIWG1_4_MIWT2_2_SVW8_VWA2
    SolutionIndex: 7
    SolutionNameMin: Cijk_Ailk_Bljk_HHS_BH_B2BG_MT32x64x32_MI16x16x16x1_SN_1LDSB0_EPS0_GRVWA4_IU1_LBSPPA128_LBSPPB0_LPA4_LPB4_MIWG2_2_MIWT1_2_PGR2_SIA3_SVW4_VWA1
    SolutionIndex: 8
    SolutionNameMin: Cijk_Ailk_Bljk_HHS_BH_B2BG_MT64x64x32_MI16x16x16x1_SN_1LDSB0_EPS0_GRVWA8_IU1_LBSPPA0_LBSPPB0_LPA4_LPB4_MIWG2_2_MIWT2_2_PGR2_SIA3_SVW8_VWA2
    SolutionIndex: 9
    SolutionNameMin: Cijk_Ailk_Bljk_HHS_BH_B2BG_MT64x64x32_MI16x16x16x1_SN_1LDSB0_EPS0_GRVWA8_IU1_LBSPPA128_LBSPPB0_LPA4_LPB4_MIWG2_2_MIWT2_2_PGR2_SIA3_SVW8_VWA2
    SolutionIndex: 10
    SolutionNameMin: Cijk_Ailk_Bljk_HHS_BH_B2BG_MT128x64x32_MI16x16x16x1_SN_1LDSB0_EPS0_GRVWA8_IU1_LBSPPA0_LBSPPB0_LPA4_LPB4_MIWG2_2_MIWT4_2_PGR2_SIA3_SVW4_VWA4
    SolutionIndex: 11
    SolutionNameMin: Cijk_Ailk_Bljk_HHS_BH_B2BG_MT128x64x32_MI16x16x16x1_SN_1LDSB1_EPS0_GRVWA8_IU1_LBSPPA0_LBSPPB0_LPA4_LPB4_MIWG2_2_MIWT4_2_PGR2_SIA3_SVW4_VWA4
    SolutionIndex: 12
    SolutionNameMin: Cijk_Ailk_Bljk_HHS_BH_B2BG_MT128x64x32_MI16x16x16x1_SN_1LDSB1_EPS0_GRVWA8_IU1_LBSPPA128_LBSPPB0_LPA4_LPB4_MIWG2_2_MIWT4_2_PGR2_SIA3_SVW4_VWA4
    SolutionIndex: 13
    SolutionNameMin: Cijk_Ailk_Bljk_HHS_BH_B2BG_MT128x64x32_MI32x32x8x1_SN_1LDSB0_EPS0_GRVWA8_IU1_LBSPPA128_LBSPPB0_LPA0_LPB4_MIWG2_2_MIWT2_1_PGR2_SIA3_SVW8_VWA2
    SolutionIndex: 14
    SolutionNameMin: Cijk_Ailk_Bljk_HHS_BH_B2BG_MT128x64x32_MI32x32x8x1_SN_1LDSB0_EPS0_GRVWA8_IU1_LBSPPA0_LBSPPB0_LPA4_LPB4_MIWG2_2_MIWT2_1_PGR2_SIA3_SVW8_VWA2
    SolutionIndex: 15
    SolutionNameMin: Cijk_Ailk_Bljk_HHS_BH_B2BG_MT128x64x32_MI32x32x8x1_SN_1LDSB0_EPS0_GRVWA8_IU1_LBSPPA0_LBSPPB0_LPA0_LPB4_MIWG2_2_MIWT2_1_PGR2_SIA3_SVW8_VWA2
    SolutionIndex: 16
    SolutionNameMin: Cijk_Ailk_Bljk_HHS_BH_B2BG_MT128x64x32_MI16x16x16x1_SN_1LDSB0_EPS0_GRVWA8_IU1_LBSPPA0_LBSPPB0_LPA0_LPB4_MIWG2_2_MIWT4_2_PGR2_SIA3_SVW4_VWA4
    SolutionIndex: 17
    SolutionNameMin: Cijk_Ailk_Bljk_HHS_BH_B2BG_MT32x128x32_MI16x16x16x1_SN_1LDSB0_GRVWA4_IU1_LBSPPA0_LBSPPB128_LPA8_LPB0_MIWG1_4_MIWT2_2_SIA3_SVW8_VWA2
    SolutionIndex: 18
    SolutionNameMin: Cijk_Ailk_Bljk_HHS_BH_B2BG_MT32x128x32_MI16x16x16x1_SN_1LDSB0_GRVWA4_IU1_LBSPPA0_LBSPPB0_LPA8_LPB0_MIWG1_4_MIWT2_2_SIA3_SVW8_VWA2
    SolutionIndex: 19
    SolutionNameMin: Cijk_Ailk_Bljk_HHS_BH_B2BG_MT32x128x32_MI32x32x8x1_SN_1LDSB0_GRVWA8_IU1_LBSPPA0_LBSPPB128_LPA4_LPB4_MIWG1_2_MIWT1_2_SIA3_SVW4_VWA1
    SolutionIndex: 20
    SolutionNameMin: Cijk_Ailk_Bljk_HHS_BH_B2BG_MT32x128x32_MI32x32x4x2_SN_1LDSB0_GRVWA8_IU1_LBSPPA0_LBSPPB128_LPA8_LPB0_MIWG1_2_MIWT1_1_SIA3_SVW4_VWA1
    SolutionIndex: 21
    SolutionNameMin: Cijk_Ailk_Bljk_HHS_BH_B2BG_MT128x128x32_MI16x16x4x4_SN_1LDSB0_GRVWA8_IU1_LBSPPA0_LBSPPB0_LPA8_LPB4_MIWG2_2_MIWT2_2_SIA3_SVW8_VWA2
    SolutionIndex: 22
    SolutionNameMin: Cijk_Ailk_Bljk_HHS_BH_B2BG_MT128x128x32_MI32x32x8x1_SN_1LDSB0_GRVWA8_IU1_LBSPPA128_LBSPPB128_LPA8_LPB4_MIWG4_1_MIWT1_4_SIA3_SVW4_VWA1
    SolutionIndex: 23
    SolutionNameMin: Cijk_Ailk_Bljk_HHS_BH_B2BG_MT128x128x32_MI32x32x8x1_SN_1LDSB0_GRVWA8_IU1_LBSPPA128_LBSPPB0_LPA8_LPB4_MIWG4_1_MIWT1_4_SIA3_SVW4_VWA1
    SolutionIndex: 24
    SolutionNameMin: Cijk_Ailk_Bljk_HHS_BH_B2BG_MT128x128x32_MI32x32x8x1_SN_1LDSB0_GRVWA8_IU1_LBSPPA0_LBSPPB0_LPA8_LPB4_MIWG4_1_MIWT1_4_SIA3_SVW4_VWA1
    SolutionIndex: 25
    SolutionNameMin: Cijk_Ailk_Bljk_HHS_BH_B2BG_MT128x128x32_MI32x32x8x1_SN_1LDSB0_GRVWA8_IU1_LBSPPA0_LBSPPB128_LPA8_LPB4_MIWG4_1_MIWT1_4_SIA3_SVW4_VWA1
    SolutionIndex: 26
    SolutionNameMin: Cijk_Ailk_Bljk_HHS_BH_B2BG_MT64x128x32_MI32x32x8x1_SN_1LDSB0_GRVWA8_IU1_LBSPPA128_LBSPPB128_LPA8_LPB0_MIWG1_4_MIWT2_1_SIA3_SVW8_VWA2
    SolutionIndex: 27
    SolutionNameMin: Cijk_Ailk_Bljk_HHS_BH_B2BG_MT64x128x32_MI32x32x8x1_SN_1LDSB0_GRVWA8_IU1_LBSPPA0_LBSPPB128_LPA8_LPB0_MIWG1_4_MIWT2_1_SIA3_SVW8_VWA2
    SolutionIndex: 28
    SolutionNameMin: Cijk_Ailk_Bljk_HHS_BH_B2BG_MT64x128x32_MI32x32x8x1_SN_1LDSB0_GRVWA8_IU1_LBSPPA128_LBSPPB0_LPA8_LPB0_MIWG1_4_MIWT2_1_SIA3_SVW8_VWA2
    SolutionIndex: 29
    SolutionNameMin: Cijk_Ailk_Bljk_HHS_BH_B2BG_MT128x128x32_MI32x32x8x1_SN_1LDSB0_GRVWA8_IU1_LBSPPA0_LBSPPB128_LPA4_LPB4_MIWG4_1_MIWT1_4_SIA3_SVW4_VWA1
    SolutionIndex: 30
    SolutionNameMin: Cijk_Ailk_Bljk_HHS_BH_B2BG_MT32x256x32_MI16x16x16x1_SN_GRVWA4_LPA0_LPB4_MIWG1_4_MIWT2_4_SVW8_VWA2
    SolutionIndex: 31
    SolutionNameMin: Cijk_Ailk_Bljk_HHS_BH_B2BG_MT32x256x32_MI16x16x16x1_SN_GRVWA4_LPA8_LPB0_MIWG1_4_MIWT2_4_SVW8_VWA2
    SolutionIndex: 32
    SolutionNameMin: Cijk_Ailk_Bljk_HHS_BH_B2BG_MT32x256x32_MI16x16x16x1_SN_GRVWA4_LPA0_LPB0_MIWG1_4_MIWT2_4_SVW8_VWA2
    SolutionIndex: 33
    SolutionNameMin: Cijk_Ailk_Bljk_HHS_BH_B2BG_MT32x256x32_MI16x16x16x1_SN_GRVWA4_LPA4_LPB0_MIWG1_4_MIWT2_4_SVW8_VWA2
- - - [3328, 64, 1, 128]
    - [0, 8073.11]
  - - [3328, 64, 1, 256]
    - [0, 13920.3]
  - - [6656, 64, 1, 128]
    - [1, 14572.9]
  - - [6656, 64, 1, 256]
    - [1, 22678.3]
  - - [3328, 128, 1, 128]
    - [2, 12054.4]
  - - [3328, 128, 1, 256]
    - [2, 20222.0]
  - - [6656, 128, 1, 128]
    - [3, 18271.1]
  - - [6656, 128, 1, 256]
    - [4, 28226.0]
  - - [3328, 256, 1, 128]
    - [5, 12622.0]
  - - [3328, 256, 1, 256]
    - [5, 21493.8]
  - - [6656, 256, 1, 128]
    - [6, 16915.3]
  - - [6656, 256, 1, 256]
    - [6, 27125.8]
  - - [3328, 64, 1, 384]
    - [0, 18188.3]
  - - [3328, 64, 1, 512]
    - [0, 19922.8]
  - - [3328, 64, 1, 640]
    - [0, 21131.7]
  - - [3328, 64, 1, 768]
    - [0, 22133.2]
  - - [3328, 64, 1, 896]
    - [0, 22664.2]
  - - [3328, 64, 1, 1024]
    - [0, 23538.4]
  - - [3328, 64, 1, 1152]
    - [0, 22455.9]
  - - [3328, 64, 1, 1280]
    - [0, 22766.1]
  - - [3328, 64, 1, 1408]
    - [0, 22538.8]
  - - [3328, 64, 1, 1536]
    - [0, 22943.5]
  - - [3328, 64, 1, 1664]
    - [0, 23131.2]
  - - [3328, 64, 1, 1792]
    - [0, 23464.1]
  - - [3328, 64, 1, 1920]
    - [0, 24044.6]
  - - [3328, 64, 1, 2048]
    - [0, 23928.5]
  - - [3328, 64, 1, 2176]
    - [0, 24072.5]
  - - [3328, 64, 1, 2304]
    - [0, 24519.0]
  - - [3328, 64, 1, 2432]
    - [0, 24512.6]
  - - [3328, 64, 1, 2560]
    - [0, 24703.6]
  - - [3328, 64, 1, 2688]
    - [0, 24648.0]
  - - [3328, 64, 1, 2816]
    - [0, 24869.2]
  - - [3328, 64, 1, 2944]
    - [0, 25271.8]
  - - [3328, 64, 1, 3072]
    - [0, 25405.3]
  - - [3328, 64, 1, 3200]
    - [0, 25312.3]
  - - [3328, 64, 1, 3328]
    - [0, 25846.2]
  - - [3328, 64, 1, 3456]
    - [0, 25472.9]
  - - [3328, 64, 1, 3584]
    - [0, 25619.0]
  - - [3328, 64, 1, 3712]
    - [0, 26044.3]
  - - [3328, 64, 1, 3840]
    - [0, 25956.2]
  - - [3328, 64, 1, 3968]
    - [0, 25962.0]
  - - [3328, 64, 1, 4096]
    - [7, 25994.7]
  - - [6656, 64, 1, 384]
    - [8, 26229.8]
  - - [6656, 64, 1, 512]
    - [9, 28904.7]
  - - [6656, 64, 1, 640]
    - [9, 29139.4]
  - - [6656, 64, 1, 768]
    - [10, 29416.0]
  - - [6656, 64, 1, 896]
    - [10, 31042.4]
  - - [6656, 64, 1, 1024]
    - [10, 32577.0]
  - - [6656, 64, 1, 1152]
    - [10, 34023.4]
  - - [6656, 64, 1, 1280]
    - [11, 35276.3]
  - - [6656, 64, 1, 1408]
    - [11, 36232.8]
  - - [6656, 64, 1, 1536]
    - [11, 36716.8]
  - - [6656, 64, 1, 1664]
    - [11, 38818.5]
  - - [6656, 64, 1, 1792]
    - [12, 39423.7]
  - - [6656, 64, 1, 1920]
    - [11, 39733.0]
  - - [6656, 64, 1, 2048]
    - [13, 40826.0]
  - - [6656, 64, 1, 2176]
    - [14, 40443.9]
  - - [6656, 64, 1, 2304]
    - [11, 40834.9]
  - - [6656, 64, 1, 2432]
    - [13, 40510.2]
  - - [6656, 64, 1, 2560]
    - [13, 41194.7]
  - - [6656, 64, 1, 2688]
    - [13, 41691.7]
  - - [6656, 64, 1, 2816]
    - [13, 41695.2]
  - - [6656, 64, 1, 2944]
    - [15, 41640.2]
  - - [6656, 64, 1, 3072]
    - [13, 42281.2]
  - - [6656, 64, 1, 3200]
    - [15, 42038.9]
  - - [6656, 64, 1, 3328]
    - [13, 42675.2]
  - - [6656, 64, 1, 3456]
    - [13, 43219.2]
  - - [6656, 64, 1, 3584]
    - [15, 43420.3]
  - - [6656, 64, 1, 3712]
    - [15, 44075.5]
  - - [6656, 64, 1, 3840]
    - [15, 45143.5]
  - - [6656, 64, 1, 3968]
    - [15, 45584.6]
  - - [6656, 64, 1, 4096]
    - [16, 46752.1]
  - - [3328, 128, 1, 384]
    - [2, 25839.0]
  - - [3328, 128, 1, 512]
    - [2, 29902.3]
  - - [3328, 128, 1, 640]
    - [2, 31928.1]
  - - [3328, 128, 1, 768]
    - [2, 31715.5]
  - - [3328, 128, 1, 896]
    - [2, 30706.3]
  - - [3328, 128, 1, 1024]
    - [17, 31139.3]
  - - [3328, 128, 1, 1152]
    - [18, 31830.2]
  - - [3328, 128, 1, 1280]
    - [18, 32451.4]
  - - [3328, 128, 1, 1408]
    - [18, 33668.4]
  - - [3328, 128, 1, 1536]
    - [18, 34529.9]
  - - [3328, 128, 1, 1664]
    - [18, 33408.6]
  - - [3328, 128, 1, 1792]
    - [18, 33590.6]
  - - [3328, 128, 1, 1920]
    - [18, 34432.0]
  - - [3328, 128, 1, 2048]
    - [18, 35008.9]
  - - [3328, 128, 1, 2176]
    - [17, 35337.7]
  - - [3328, 128, 1, 2304]
    - [17, 35212.7]
  - - [3328, 128, 1, 2432]
    - [19, 36005.1]
  - - [3328, 128, 1, 2560]
    - [17, 35665.8]
  - - [3328, 128, 1, 2688]
    - [17, 35849.4]
  - - [3328, 128, 1, 2816]
    - [17, 36304.5]
  - - [3328, 128, 1, 2944]
    - [18, 36573.4]
  - - [3328, 128, 1, 3072]
    - [17, 37369.7]
  - - [3328, 128, 1, 3200]
    - [17, 37137.4]
  - - [3328, 128, 1, 3328]
    - [18, 36689.2]
  - - [3328, 128, 1, 3456]
    - [17, 36857.5]
  - - [3328, 128, 1, 3584]
    - [17, 36918.9]
  - - [3328, 128, 1, 3712]
    - [18, 37621.1]
  - - [3328, 128, 1, 3840]
    - [18, 37587.4]
  - - [3328, 128, 1, 3968]
    - [18, 37431.5]
  - - [3328, 128, 1, 4096]
    - [20, 39781.2]
  - - [6656, 128, 1, 384]
    - [4, 33986.4]
  - - [6656, 128, 1, 512]
    - [21, 35147.8]
  - - [6656, 128, 1, 640]
    - [21, 38377.4]
  - - [6656, 128, 1, 768]
    - [21, 40921.8]
  - - [6656, 128, 1, 896]
    - [22, 42938.8]
  - - [6656, 128, 1, 1024]
    - [22, 47798.2]
  - - [6656, 128, 1, 1152]
    - [23, 49512.1]
  - - [6656, 128, 1, 1280]
    - [24, 52330.2]
  - - [6656, 128, 1, 1408]
    - [25, 52542.6]
  - - [6656, 128, 1, 1536]
    - [25, 50201.3]
  - - [6656, 128, 1, 1664]
    - [21, 52745.7]
  - - [6656, 128, 1, 1792]
    - [24, 53705.0]
  - - [6656, 128, 1, 1920]
    - [21, 52621.9]
  - - [6656, 128, 1, 2048]
    - [22, 58370.7]
  - - [6656, 128, 1, 2176]
    - [22, 60668.2]
  - - [6656, 128, 1, 2304]
    - [24, 60418.0]
  - - [6656, 128, 1, 2432]
    - [21, 57290.7]
  - - [6656, 128, 1, 2560]
    - [22, 58134.7]
  - - [6656, 128, 1, 2688]
    - [25, 58671.6]
  - - [6656, 128, 1, 2816]
    - [25, 59569.2]
  - - [6656, 128, 1, 2944]
    - [25, 57567.8]
  - - [6656, 128, 1, 3072]
    - [21, 58141.1]
  - - [6656, 128, 1, 3200]
    - [26, 58882.5]
  - - [6656, 128, 1, 3328]
    - [27, 58134.4]
  - - [6656, 128, 1, 3456]
    - [28, 58454.1]
  - - [6656, 128, 1, 3584]
    - [29, 59469.9]
  - - [6656, 128, 1, 3712]
    - [25, 61228.3]
  - - [6656, 128, 1, 3840]
    - [24, 62877.8]
  - - [6656, 128, 1, 3968]
    - [24, 63165.2]
  - - [6656, 128, 1, 4096]
    - [22, 67364.1]
  - - [3328, 256, 1, 384]
    - [5, 27237.0]
  - - [3328, 256, 1, 512]
    - [5, 31173.0]
  - - [3328, 256, 1, 640]
    - [30, 33279.5]
  - - [3328, 256, 1, 768]
    - [5, 36223.8]
  - - [3328, 256, 1, 896]
    - [5, 36776.9]
  - - [3328, 256, 1, 1024]
    - [5, 40074.9]
  - - [3328, 256, 1, 1152]
    - [5, 41133.6]
  - - [3328, 256, 1, 1280]
    - [5, 41909.4]
  - - [3328, 256, 1, 1408]
    - [5, 38603.5]
  - - [3328, 256, 1, 1536]
    - [5, 37128.5]
  - - [3328, 256, 1, 1664]
    - [31, 36929.4]
  - - [3328, 256, 1, 1792]
    - [31, 36200.0]
  - - [3328, 256, 1, 1920]
    - [31, 35427.1]
  - - [3328, 256, 1, 2048]
    - [5, 48413.9]
  - - [3328, 256, 1, 2176]
    - [5, 47874.1]
  - - [3328, 256, 1, 2304]
    - [30, 43361.1]
  - - [3328, 256, 1, 2432]
    - [6, 40883.1]
  - - [3328, 256, 1, 2560]
    - [31, 40039.7]
  - - [3328, 256, 1, 2688]
    - [32, 38789.4]
  - - [3328, 256, 1, 2816]
    - [31, 38078.1]
  - - [3328, 256, 1, 2944]
    - [33, 38844.3]
  - - [3328, 256, 1, 3072]
    - [31, 40047.3]
  - - [3328, 256, 1, 3200]
    - [31, 40150.0]
  - - [3328, 256, 1, 3328]
    - [31, 38639.5]
  - - [3328, 256, 1, 3456]
    - [31, 37560.0]
  - - [3328, 256, 1, 3584]
    - [31, 38324.2]
  - - [3328, 256, 1, 3712]
    - [33, 39318.2]
  - - [3328, 256, 1, 3840]
    - [31, 40695.9]
  - - [3328, 256, 1, 3968]
    - [31, 41239.7]
  - - [3328, 256, 1, 4096]
    - [30, 51840.6]
  - - [6656, 256, 1, 384]
    - [6, 36030.7]
  - - [6656, 256, 1, 512]
    - [6, 38414.0]
  - - [6656, 256, 1, 640]
    - [6, 45211.5]
  - - [6656, 256, 1, 768]
    - [6, 48077.5]
  - - [6656, 256, 1, 896]
    - [6, 48735.5]
  - - [6656, 256, 1, 1024]
    - [6, 57004.1]
  - - [6656, 256, 1, 1152]
    - [6, 58504.1]
  - - [6656, 256, 1, 1280]
    - [6, 56482.5]
  - - [6656, 256, 1, 1408]
    - [6, 55206.0]
  - - [6656, 256, 1, 1536]
    - [6, 57287.7]
  - - [6656, 256, 1, 1664]
    - [6, 56632.3]
  - - [6656, 256, 1, 1792]
    - [6, 59100.1]
  - - [6656, 256, 1, 1920]
    - [6, 59931.3]
  - - [6656, 256, 1, 2048]
    - [6, 72062.2]
  - - [6656, 256, 1, 2176]
    - [6, 71127.8]
  - - [6656, 256, 1, 2304]
    - [6, 64633.8]
  - - [6656, 256, 1, 2432]
    - [6, 63539.6]
  - - [6656, 256, 1, 2560]
    - [6, 65223.3]
  - - [6656, 256, 1, 2688]
    - [6, 66415.7]
  - - [6656, 256, 1, 2816]
    - [6, 68709.5]
  - - [6656, 256, 1, 2944]
    - [6, 67871.8]
  - - [6656, 256, 1, 3072]
    - [6, 69593.7]
  - - [6656, 256, 1, 3200]
    - [6, 68239.2]
  - - [6656, 256, 1, 3328]
    - [6, 69242.6]
  - - [6656, 256, 1, 3456]
    - [6, 69920.5]
  - - [6656, 256, 1, 3584]
    - [6, 71018.8]
  - - [6656, 256, 1, 3712]
    - [6, 72726.7]
  - - [6656, 256, 1, 3840]
    - [6, 70525.6]
  - - [6656, 256, 1, 3968]
    - [6, 71287.9]
  - - [6656, 256, 1, 4096]
    - [6, 86361.8]
- null
- null
- DeviceEfficiency
- null
- GridBased
